author,comments,reply_comments,reply_authors,update
今天见红了,$汽车整车(BK1029)$,,,11-27
湖北宋宇飞,跳水,,,11-27
江湖股者,奇了个怪了汽车整车，今天居然没有一只涨1%以上的，大盘都在反弹，汽车也就垃圾股涨,,,11-27
股友23d673926q,有没有发现，汽车板块涨的都是那些垃圾车，像众泰、海马之类的，反而优质的车企一直不,,,11-14
今天见红了,3万亿消费，利好新能源汽车。,,,11-27
长城的主力粑粑,丢脸,,,11-25
江湖股者,整车板块垃圾中得天花板！,,,11-25
回本难呀,没有一只股红,,,11-21
友善de莎拉,3.34缺口来了,,,11-21
梦境的游人,往下跌吧，跌10个点，20个点一次性跌到头,,,11-21
拉高出货套人,全军覆没了,,,11-21
未来世界科技巨头,大家看空26年汽车，内卷，购置税。但新技术最容易激发新消费需求。如果辅助驾驶、电,,,11-21
有领导力的唐炯8,0获利,,,11-21
迷人de圣手书生,新款S9,,,11-21
梦境的游人,整车回调，这下完蛋了，天天砸盘。,,,11-19
股林林萌主,汽车板块天天砸,,,11-20
梦境的游人,整车完蛋了砸盘砸的没完没了,,,11-18
回头是岸555,尾盘冲一下,,,11-18
辣椒a股,这个板块要不就关掉解放算了，别丢人现眼了,,,11-18
股友7595h8751K,整个板块最有投资价值的是海马和众泰，真搞笑。,,,11-14
年年钵满de洪七公,整个板块26个票，涨幅过板块的就6个…这板块指数…,,,11-14
江湖股者,海马百亿市值居然带动了1.5万亿流通整车板块！假货,,,11-14
股友518zT18527,又成一哥了，厉害,,,11-14
长城的主力粑粑,永远轮不到这个板块。,,,11-13
江湖股者,汽车板块居然靠3只垃圾，指数一路向上，是不是该改一下了！,,,11-13
长城的主力粑粑,哈哈，销量越差的车，只能靠拉股价挣钱吗,,,11-13
被按着摩擦的韭菜,整车是真的废了，汽车难道不是消费品？,,,11-12
股友89c7y76529,赛力斯和千里王8重庆汽车的哼哈二将,,,11-11
蚂蚁的寂寞生活,板块就一个股票涨，别的都是僵尸，太搞笑,,,11-07
江湖股者,垃圾板块就靠垃圾海马，或者垃圾众泰,,,11-07
慢慢买吧,了吗？权重都绿的啊。,,,11-07
皓月当空日,88888089.2@股友An77787611...,,,11-06
qnnndx,汽车股之前用准倒闭股众泰撑场面，现在用亏损股海马撑场面，其他的都是,,,11-05
梦境的游人,到头儿汽车股到头儿天天往下,,,11-04
红旗遍天下,整个汽车板块都是由小盘股烂公司ST公司来支撑整个板块，上汽、比亚迪、这些龙头天天,,,11-04
股友9q513U6150,比亚迪。以后不要买比亚迪的车子，跟机构联手搞股民。,,,11-03
常言道8,第一名很容易啊！上汽绿贾秋,,,11-03
江湖股者,靠垃圾股带动的板块！,,,11-03
CNS315,啊,,,11-02
未来中药茅台以岭,$汽车整车(BI1029)$$房地产(IS931775)$$中药(BI1040),,,10-30
回本难呀,五粮液都造车了,,,10-30
梦境的游人,汽车股废了，太烂了现在的,,,10-29
被按着摩擦的韭菜,整车板块被资本抛弃了吗？？？废到现在还没起色。,,,10-29
陌生人丫,这个板块废了,,,10-27
股友75610F312h,把众泰的车都发出来，打打气,,,10-24
股友Z0v2561152,r里m垃圾退市,,,10-23
有条理的严晟,整车板块都不咋样，但阿泰今天是真给力啊,,,10-22
普智,$汽车整车(BK1029)$,,,10-21
青峰剑剑剑锋青,汽车板块走的是芯片的老路，亏损涨，优质稳，长久不了,,,10-21
梦境的游人,破整车,,,10-20
梦境的游人,汽车整车有毛病，大盘砸他也往下砸，今天往上涨，他还往下砸,,,10-20
股友3781E3m235,垃圾重汽带崩了板块,,,10-20
车门巴菲特,#股市怎么看#,,,10-19
生财有道的伟喵喵,利空江淮货车！,,,10-18
利興达,整个板块跌沟里,,,10-17
卷不动卷不动了,凑个235，你是要炸金花么去打**么,,,10-17
股友31059e8O69,一上午跌完了几天涨的,,,10-17
股友uPjpiz,汽车行业不振的话，经济就搞不上去,,,10-17
湘财铁头娃,月底业绩为王的时代,,,10-17
三思而后不行,长安汽车一只股带板块跌,,,10-17
美女的不是,新能源汽车补贴没有了，板块只能了,,,10-17
慢牛多调整,$汽车整车(BI1029)$,,,10-17
慢牛多调整,也该轮到汽车板块了，世界智能网联汽车大会今天在北京开幕！,,,10-16
回本难呀,放量上涨还要涨,,,10-16
钱先生a,时间窗口，本周五！,,,10-15
麻豆G,$汽车整车(BK1029)$,,,10-15
麻豆G,$汽车整车(BK1029)$,,,10-15
穿过表象看真实,汽车都亏了一塌糊涂都还能涨，所以讲故事才是最重要的，绝大部分人都愿意被会讲故事的,,,10-15
葛大壮,016371是绝世好基金，冲鸭弟兄们,,,10-15
葛大壮,588200崛起在即，冲鸭弟兄们,,,10-15
甘佑嘉措,汽车板块的楼梯图最标准啊～～～,,,10-14
回本难呀,这是什么鸟板块，无耻之徒,,,10-14
假药无底洞,今年汽车板块就是垃圾板块，超市零售百货板块都比你强……,,,10-13
梦境的游人,整车你不给力呀,,,10-09
大盘是我砸的,十月一节前半小时跳水,,,09-30
股友zq0gqn,这板块全是赛力斯带起来的,,,09-30
陌生人丫,现在汽车股是废了！,,,09-30
江湖股者,一个板块居然靠众泰和海马,,,09-30
股友09888X19p7,捷佳伟创一季度业绩表现强劲，营业总收入同比增长58.95%，净利润增长22.15,,,09-29
追涨的小牛,整个板块天天让一些不入流的做龙头，太弱了,,,09-25
骑着树刚打林平,没补贴咯,,,09-28
养家糊口赚点小钱,美国搞完半导体芯片又搞医药,,,09-26
股林林萌主,整车板块太Lj了，天天拉高套人,,,09-26
语家军,兄弟们，我们昨天发现的今天开始有动作！今天可以高抛的哦！爽吧今天可以分仓去低吸哦,,,09-26
葛大壮,588200暴涨在即，冲鸭弟兄们,,,09-26
湖北宋宇飞,444,,,09-25
股友ufMA3R,没人玩了，只剩主力量化表演！,,,09-24
一弦稽琴格,其他板块都翻倍了，政策利好这么多，怎么也拉到2400,,,09-17
湖北宋宇飞,444,,,09-23
追涨的小牛,板块全烂咋搞嘛,,,09-23
青云子子,新进的散户，在板块挑股的时候，把广汽忽略掉，这个公司靠散户续命,,,09-22
湖北宋宇飞,444,,,09-22
zgsxchzsc,电池涨装电池的汽车跌，就好像是面涨面条跌,,,09-22
追涨的小牛,恕我直言，此板块已被妖邪寄生，弱者恒涨,,,09-22
董秘解答,今年主线没有汽车，没人玩,,,09-16
股友uPjpiz,汽车股太惨了,,,09-19
湖北宋宇飞,444,,,09-19
股友8e5785U368,又是倒数第一,,,09-18
才望兴隆de令狐冲,无耻至极,,,09-18
股友378N9F5107,整个汽车板块，除了江淮,,,09-17
股友8e5785U368,老配方,,,09-17
股友99268u6m71,论下跌主力和资金流出还得看央企长安,,,09-16
八方善贾de黄药师,国家层面的重大利好，怎么跌啦,,,09-16
开始赚票票啰,终于轮到我啦，坐上板块龙头老大的头把交椅,,,09-16
股友1webxjitko7,要成角了,,,09-16
STt9,国外新能源汽车大涨，国内不涨,,,09-16
勇敢坚毅的悦儿6,每次发布会都大跌昨天尾盘卖了，不相信你,,,09-16
华南宝安大道,赛力斯的爸爸叫江淮,,,09-15
麻木的散户Jack,就这种越差的公司账的越好，越亏损的公司涨的越多的市场氛围，还想长牛，做梦都比这个,,,09-15
股友L936032M71,亏损能飞上天？业绩好的股票跌跌不休？,,,09-15
惬意的温琦,159806是绝世好基，冲鸭弟兄,,,09-15
麻木的散户Jack,没有众泰，这个板块指数要跌成狗。一个汽车板块指数，居然靠一个今年只卖了14辆车的,,,09-14
微笑的迪妮莎DJ,这板块靠两个亏损股拉指数,,,09-12
股友uPjpiz,怎么今天指数还涨了？,,,09-12
江湖股者,这板块指数是假的！,,,09-12
股友19Y723297a,涨靠前全部是亏损股，为啥,,,09-12
追涨的小牛,扭曲颠覆逻辑的板块，绩优股都在垫底，破产亏损天天霸占鳌头，撤退,,,09-12
股友09888X19p7,金杯电工2025Q1净利润持平，非经常性收益对冲了信用减值损失的影响。其他收益与,,,09-11
好奇的文昭1,垃圾板块，都不如房地产,,,09-09
股市断魂,终于混成了板块倒数第一……,,,09-09
万金来c,汽车股的龙头居然是众泰,,,09-09
葛大壮,159667绝世好基，冲鸭弟兄,,,09-09
湖北宋宇飞,744,,,09-09
淋雨的燐,今天整个板块成交256亿byd59亿赛力斯63这俩成交就占一半了,,,09-08
自信且坚韧001,有趣这板块，只有没车的泰哥才是核心，超预期吗,,,09-08
n542613572056874,比亚迪完胜,,,09-06
永远之林,汽车应该安全为第一位，再好看的车，也只是个油漆马桶，珍爱生命，不当小白鼠。国产车,,,09-06
丙丁乙乙,一心造车，以安全为第一！看好它。,,,09-03
股友235231gQ03,日本汽车大涨,,,09-04
虾滑炒蛋,byd就扶不起的阿斗,,,09-04
小悟空闪电豹,现在长安汽车均为小盘股了。不跟指数跟垃圾退市股一起涨，还涨的挺多的，零点几,,,09-04
股友7899e6028W,汽车类上市公司，国内成熟国外还有一定空间，头部公司也过了增长期，无非此起彼落，不,,,09-03
股友9605MP1215,603017中衡设计：参股多家芯片独角兽、城市高质量设计总龙头+商业卫星发射场设,,,09-03
梦境的游人,高开那么多就是为了套人吗？,,,09-03
n1429694160449071580,写的什么文章，恶意抹黑比亚迪！什么停滞不前，国外都把特斯拉扯下来了！后面真成全球,,,09-02
周六不下班,岚图,,,09-02
股友2L029R5099,吉利迟早反超登顶,,,09-02
股友Y5877k1075,随着电动智能汽车时代的来临，行业在不断的成熟，就像2007年智能手机的大爆发一样,,,09-02
托天王,无知的媒体，一跌，各种坏消息都不来，一张啥都优秀,,,09-02
股友8l6718l578,新m7爆款,,,09-02
DNMMDF,下午万手哥上班了！！！,,,09-02
股友w206x36177,比亚迪的销量都被吉利抢走了,,,09-02
翡翠满腹de律香川,三电匹配好,,,09-02
西蓝花931,比亚迪确实难，高端市场销量低迷，中低端市场被小鹏和零跑抢夺，更不用说还有其他传统,,,09-02
霸道2,按自己的规划走，要落实技术与安全并行，才是企业生存发展之道,,,09-02
我问心之道,长安,,,09-02
今媒评,汽车质量是长跑竞赛项目，质量稳定并不断提高，那车就不愁卖。,,,09-02
开心的吕心宇1,本来想买长安汽车的，现在看来绝对不能买，希望国人擦亮眼睛，国产中的垃圾品牌。,,,08-29
在路上的苏小语,猛砸长安，比亚迪，真是好样的,,,09-01
怀念权证,看看我选股水平怎么样,,,09-01
白酒有毒,房地产融资贷款彻底转移到汽车上面来了,,,08-29
祝你好运啦,新能源看中国，中国看江淮,,,08-29
娴雅文静的石港,整车今年算是废了,,,08-28
陆肘Z,垃圾众泰涨了9个点，直接把整车带起来了，其实其他的都没涨,,,08-28
江湖股者,全市场唯一被抛弃的板块，实在无语,,,08-25
股友L936032M71,明天也应该轮到汽车板块起飞了吧。,,,08-25
江湖股者,汽车板块没涨不说今天流出43亿，排名前列！,,,08-27
股友16F511L985,查的,,,08-27
追涨的小牛,舍‘车’保帅,,,08-27
江湖股者,汽车整车轮动就是出来搞笑的早盘5分钟完事！,,,08-27
梦境的游人,看来整车是到头儿了，又该回调了,,,08-27
欢快的魏夏圆,$汽车整车(BK1029)$,,,08-27
股林林萌主,汽车板块错过牛市,,,08-25
江湖股者,买车是倒了血霉，涨没涨过，跌还第一名,,,08-25
最佳新人,板块倒数第一？？,,,08-25
江湖股者,汽车整车没怎么涨还是倒数前三，今天都绿？,,,08-25
兴奋地楚留香,汽车行业带动上下游产业对国家的贡献是显而易见的，结果涨得费劲,,,08-25
陆肘Z,什么时候可以多加几只股票进来啊，少的可怜。,,,08-22
股友uPjpiz,指数涨这么多，到底是哪支汽车股在涨呀？,,,08-22
股友8e5785U368,你看看江淮，你到底跟谁,,,08-22
股友613r90Z062,今天的目标看来是为突破3800，所以要涨大市值的。,,,08-22
大发腾达的周瑜,$供销大集(SZ000564)$$正和生态(SH605069)$$汽车整车(BK,,,08-22
敢于割肉,感觉今天要有机会的话，应该在昨天顶住了抛压,,,08-22
江湖股者,汽车板块就是仅次于房地产一样垃圾，没有一只拿得出手,,,08-21
创越的力量,这个指数根本不准。指数新高了，却没有一只个股是新高的，怎么解释？,,,08-21
开朗之圣手书生,$汽车整车(BK1029)$$长安汽车(SZ000625)$,,,08-20
游资坨,我买了个板块第一，优秀,,,08-15
常睿懂事涨,千里科技，动力新科，都涨停了，福田3年多，1089个交易日没涨停过，,,,08-20
梦境的游人,整车股创新高了，我的还没回本儿,,,08-18
股友09888X19p7,捷佳伟创2025年一季度业绩表现强劲，营业总收入同比增长58.95%，净利润增长,,,08-14
股友K29603e185,整车板块就是边角料,,,08-14
股友P5cxVf,谁能想到这个板块的龙头会是长安B,,,08-14
陆肘Z,汽车零部件从最初的800涨到了4万多，汽车整车这个玩意儿怎么还在1000多，谁能,,,08-11
静听东来,明天创新高能岀来一两个能打的不！,,,08-11
江湖股者,整个市场似乎把汽车整车板块遗忘，长城那个魏孙子是罪魁祸首,,,08-13
聪明的想爱泉7,这还是人干的事情吗？你看看指数都涨到什么程度了。。。,,,08-13
股友8e5785U368,又是倒数,,,08-12
股友P5cxVf,啥时候新高？？？明天吗？,,,08-11
江湖股者,这垃圾板块，实数严重失真，板块里面除了江淮，躲过牛市,,,08-08
股友P5cxVf,板块不突破，任何个股的拉升都等于圈圈,,,08-08
股友GE0T2W,冲啊,,,08-08
股友Po9NZD,$汽车整车(BK1029)$,,,08-07
享界s9厂长,倒数第一,,,08-05
被按着摩擦的韭菜,大资金什么时候轮动到整车？全仓在整车。,,,08-04
编号391015,汽车基本上见顶了，历史新高了,,,08-01
才望兴隆de令狐冲,……,,,08-01
蕙质兰心的鲁菡荧,你这个板块涨的很多吗，跌那么狠,,,07-31
股友P5cxVf,不明白除了江淮其他几个汽车权重这段时间也没涨啊，怎么板块看起来涨的还可以,,,07-31
梦境的游人,整车到头儿开始回调,,,07-31
短线实盘侠,海马股中有退市风险的ST价格都比你高许多，海南唯一有新能源资质的整车车企，自贸区,,,07-30
才望兴隆de令狐冲,金龙最拉基,,,07-30
股友7G92x26182,新能源汽车板块近期新增投入聚焦于技术迭代与产能扩张，头部企业加速布局固态电池和8,,,07-30
才望兴隆de令狐冲,你这个拉基倒数第一,,,07-28
江湖股者,这垃圾板块怎么都轮不到了呢，几个月没有一只涨幅单天上5个点的,,,07-23
被按着摩擦的韭菜,大盘都3600了，这个拉几整车板块，一点动静都没有，拉几魏还有影响吗？？？？,,,07-23
被按着摩擦的韭菜,整车板块，狗都不买，很长时间没轮动到了。,,,07-22
股友X79k156287,新王再现！持有无虞……,,,07-22
焦急的张丹5,赛力斯最拉鸡的之一,,,07-21
管理咖啡馆,看到没？基建ETF（516950）开盘就冲涨停，国家队这次玩真的！1.2万亿砸下,,,07-21
基民l316920C10,没钱买,,,07-21
股友eFCgsX,买二手车,,,07-21
棒棒2024,还是贵,,,07-18
股友ij5A2F,〒_〒_^,,,07-18
股友P5cxVf,汽车板块看起来是突破下降压制线了，但是我的个股还是垃垃圾圾，加油啊,,,07-17
你的天空8,汽车炒反内卷炒不起来,,,07-17
财之海洋,历史都是惊人的相似，七八月份汽车翻倍吧,,,07-16
才望兴隆de令狐冲,老六,,,07-16
热情的剑山蝶0,汽车股都没人接盘，只能继续维持，或继续涨了，,,,07-15
江湖股者,汽车整车每次就是3秒钟,,,07-15
股友a5699860y5,买赛力斯,,,07-14
万豪4375,002019亿帆医药抗癌药下午可能涨停,,,07-14
被按着摩擦的韭菜,大盘都拉冒烟了，什么时候轮动到汽车板块？？？,,,07-14
静听东来,反内卷整起来！,,,07-13
乐彬呵呵9048,渣渣,,,07-12
布兰妮,汽车行业不是反内卷吗？,,,07-11
江湖股者,整车废了，最好的才1个点,,,07-11
股市战胜,证卷一拉都打压，涨少跌多货出多，现时行情真难说，快进快出不趴窝。,,,07-11
股友c18380k373,我觉得汽车股真的比那外买平台股有价值,,,07-10
梦境的游人,汽车股到头儿，开始回调了这，完了,,,07-10
股友c18380k373,汽车股成股市弃儿,,,07-09
江湖股者,反内卷的都在涨，累计涨幅好多10多个点了，就整车不涨反跌,,,07-09
被按着摩擦的韭菜,自从魏以后，汽车板块就没异动过，涨过，资金都不来汽车板块。问候它一下。,,,07-08
被按着摩擦的韭菜,汽车板块太烂了，八成以上都是织布机。毫无成长，还喜欢相互揭短。,,,07-03
追涨的小牛,此板块有一大半的票都是缝纫机,,,07-01
经纶大展de张良,二三流的板块就是垃圾,,,07-01
穿行月3556,汽车股为什么这么拉胯？,,,06-30
凤颂路,整天在补缺口的路上,,,06-30
豫QW45N1,自动驾驶老美涨疯了，我们为什么不能疯一回？,,,06-30
墨芯微,真可怜，打价格战你跌！不打价格战了，你还是跌！,,,06-30
博士后论股,公告：关于自行申请注销生产资质的通告,,,06-14
股友81x8x95516,魏公公一句话把汽车板块利好全整没了,,,05-26
鑫河鑫,我就不信今天版块把江淮拉不红！,,,06-24
基民55751v7M90,你在$汽车整车(BI1029)$ $中概股(USBLOCK|US36966)$,,,06-23
有耐心的耿榕1,广汽这种垃圾怎么不退市,,,06-23
尧老板66走,还是向下,,,06-22
湖北宋宇飞,765,,,06-20
有庄的模拟盘15,板块都是历史高位为什么这么神奇,,,06-20
股友783f50028e,擦，你起来一下干嘛，直接往下泄呗,,,06-20
森林木北,汽车股,,,06-20
追涨的小牛,汽车已死，被绞死，卷死,,,06-19
青云子子,整个汽车股.谁有广汽狠.来一个套一个,,,06-18
豫QW45N1,跌惨了，亏惨了，割肉割掉了,,,06-18
喜悦的严亦寒5,垃圾垃圾,,,06-18
夜村长,别的股票涨多了跌，你是今天跌，明天跌，天天喋喋不休,,,06-17
夜村长,全场消费，由长安汽车朱华荣买单。,,,06-17
接受平凡之路,价格战没子弹了，会怎么样呢，汽车大涨价？,,,06-16
僵尸户,今天整车板块涨不涨，就看广汽集团！,,,06-12
常睿懂事涨,万里科技，鼠光，北气绿谷，中铜汽车全部涨停,,,06-12
股海阳光,国企付民企货款就应该及时，拿的是国家资本，不能和民企付款周期一样！,,,06-11
新老小韭菜,成长龙头!自己感觉配拥有吗？服了啊,,,06-10
严格执行88888,明天可以升,,,06-09
股海里的小石头,明天整车发力，大红！比亚迪做领头羊！,,,06-05
股友81x8x95516,再涨啊,,,06-09
价值交易财经,假如可以和比亚迪重组会不会暴涨50个涨停板,,,06-09
追涨的小牛,绿一周,,,06-06
东翰股道,周末有利好,,,06-06
東莞周杰倫,汽车板块已经回调到20日线了，属于闭眼入的位置，加上汽车下乡的消息，作为板块龙头,,,06-03
股海里的小石头,明天大红,,,06-04
三思而后不行,说的下乡呢,,,06-04
四川大哥,汽车板块今天的走势说明了一切，，摆烂了这个汽车板块,,,06-04
有教养兔子1,整车股的春天来了。明天估计进不去啊。,,,06-03
鲁地金犁头,汽车整车，产能过剩严重还在炒作，跟当年没落前房地产一摸一样套路不变。,,,05-29
四川大哥,汽车已经不会涨了，清仓吧各位,,,06-03
股友JCzlMH,涨没见几个次，跌动不动第一。汽车废了,,,06-03
股友05u86d0516,0公里二手车,,,06-02
小曼鱼123,整车板块成份股市值前十的才一家涨了3.1，整个板块就涨了3.1%，板块涨幅是怎么,,,05-30
股友8F0AM5,马上会崩,,,05-29
风中美洲豹,今天是整车票的最后一天！再见,,,05-29
常言道8,倒数第三，真是好样的上汽集团。,,,05-29
股友70L058x732,政府采购国产车，,,,05-29
憨态可掬的薛筱蓓,今天涨的不少啊！下午走势不知道会咋样，大家觉得手里现有的股票是趁这波涨势卖了，还,,,05-29
咸鱼求翻身w,汽车主线带动各产业链,,,05-29
咸鱼求翻身w,如果第一产业链在过去是白酒主力军的话，那么未来国产汽车替代外资汽车是趋势，智驾和,,,05-29
andrew007212,防止内卷，主要针对的是汽车，算是小利好吧。,,,05-28
股友7595h8751K,真的是悲哀，一句话可以影响整个板块。,,,05-26
股友c18380k373,汽车板块已经成为垃圾板块，没资金进去，真悲哀,,,05-27
股友5D8076h615,连续15个交易日内，只红了3个，千里科技怎么了？,,,05-27
后惫马甲,老魏还是老了，以前老说什么电动混动，一副看不起，现在还不是屁颠屁颠跟着BYD做混,,,05-26
KevinJay,笛子带崩全场,,,05-26
一百万100万,下跌,,,05-26
n142040345664cfc,烧死的人还少吗,,,05-26
气宇轩昂的夏浩源,还是民企汽车强就剩下这些国企央企的汽车厂起不来，国企还是国企管理就是不一样,,,05-25
涅槃88888,长安汽车主力经过一年多的建仓吸筹，即将走主升浪行情了，华为公主加入是点火,,,05-25
炒股赚包烟钱,曙光汽车有吉利和丹东重组预期，氢能源重卡，出口阿联酋，俄罗斯海外多地，车桥之王，,,,05-23
博士后论股,警钟长鸣——一退市前多次提醒警告了！到时候不要哭爹喊娘。已申请注销生产资质。江南,,,05-24
博士后论股,警钟长鸣——一已申请注销生产资质。江南商标已驳回没有效了,,,05-24
杭州小汪,关于北汽，还有一个要明确的是北汽蓝谷是30-50万的华为汽车的唯一合作伙伴，中国,,,05-23
一颗菜1,很神奇，大盘板块涨了一个月，它一动不动，这稍微回调一点。烂股就首当其冲,,,05-23
股友710l1a6673,真墨迹,,,05-23
惬意的温琦,517390下午雄起，速度买入,,,05-23
葛大壮,517390下午，加油冲鸭弟兄们,,,05-23
股友8U981d0932,汽车板块给大家竖中指吗,,,05-22
股民湘,没买江淮的都买北汽。北汽蓝谷销量前三名，实质性利好啊！第二个江淮也！,,,05-22
韭菜给别人养爸妈,明天到整车了吧,,,05-21
从零起步1,两江赛比,,,05-21
炒股赚包烟钱,曙光汽车才摘帽，拥有26个全车牌资质，有丹东国资和吉利收购预期，今年车桥增速20,,,05-16
掐指算涨停,板块之间先先涨啥后涨啥是不是有迹可循呢,,,05-19
三峡能源A,倒数第一,,,05-16
一路稳健,表现不错,,,05-16
财之海洋,前几年的军工都翻几倍了，汽车怎么回事还不来几倍,,,05-16
十一是小哥哥,实在没想到你能绿的,,,05-13
有魄力的冷小泥,“IGV智能引导车通过先进的无人驾驶技术，能够实现在港口环境中的高效、安全运输。,,,05-08
有魄力的冷小泥,中国无人驾驶商用车在港口场景的市场规模正经历快速扩张，随着技术进步和应用普及，中,,,05-08
有魄力的冷小泥,加强安全培训、发出联合安全倡议、推进技术研发……近期，车企和供应商纷纷弱化对智能,,,05-08
财之海洋,大众交通它们都又回来了，汽车整车给力点呀,,,05-07
独立的爱飘心111,有考虑把长安汽车移除板块吗？不想带它玩可以直说,,,05-06
股民的股,黑猫啥时候来点利好啊,,,04-28
海洋战略工程2030,业绩变脸太快，顺间觉得市盈率11的深海采掘科技龙龙好香。,,,04-26
梦境的游人,又有什么消息了？开始砸盘了,,,04-25
股友235231gQ03,五一放假私家车买那款好,,,04-25
独立的爱飘心111,不想带长安汽车玩可以把长安汽车移除板块，不怪你,,,04-22
惬意的温琦,159770速度买入，加油冲，弟兄们,,,04-22
谨言慎行五十,汽车板块又是走独立行情吗,,,04-17
风光在险峰难得见,汽车板块反弹还是不错的！东风股份有点差！,,,04-16
涨停发财,lj,,,04-16
涨停发财,泵pan快pai,,,04-16
涨停发财,蹦盘快跑,,,04-16
大叔抵不住诱惑,拉几板块，居然让两个ST当老大,,,04-16
股友6n715f0309,$汽车整车(BK1029)$,,,04-16
蒸蒸日上83158,真烂，汽车月线跌4.6个点，大盘月线跌2个点，你暴跌18个点，汽车行业26家，你,,,04-15
和大多数人作对,2个没机构和量化的st第一第二,,,04-15
烦躁的小熊,广弃这垃圾就是个广告公司，都别进,,,04-14
n2146133299363506201,汽车板正在寻球接盘,,,04-14
大豪总,海马汽车还有救吗。为啥一直跌跌不休,,,03-25
慢牛多调整,近1年，汽车板块涨了23%，长安跌了23%，这46%的差距还补吗？,,,04-14
n369213688741518,江淮你可是拉圾了，去看看全市场有几家绿的，为了尊界的一切。,,,04-09
大叔抵不住诱惑,拉几板块，不如两个ST股,,,04-10
假药无底洞,汽车板块啥时候来个主升浪呀,,,04-10
气冲盛和升金,现在中国与老美进行对决的关键时候，任何做空的们都不会有好下场的。为了维护咱们,,,04-08
股友9M76802G90,又倒数第一,,,04-09
谨慎的吕蕴庚,这个板块就没有见它涨过。看来汽车是没有人要的玩意呀。,,,04-09
股友89c7y76529,港股汽车涨那么多,,,04-08
十一连冠,汽车整车，现在好弱啊。,,,04-08
股友235231gQ03,汽车股全部跌停了,,,04-07
股民湘,中国新能源汽车，特别是江淮汽车没有出口美国，主要是欧亚和非洲，不受关税影响。东风,,,04-06
趋势交易123,汽车整体走势还是太弱了,,,04-03
立志型男,这时候你想起是一伙的了，真特么恶心,,,04-07
