author,comments,reply_comments,reply_authors,update
高laoshi,【下半年还会发餐饮消费券吗？上海市商务委正在研究可行方案】记者从上海市商务委获悉,,,06-30
股友13W5092U78,食品饮料何时变成了毒药？！,,,06-29
求求了别跌了,差不多了吧，快给我涨,,,06-27
股友67y2A22137,这个急牛让人不踏实,,,06-26
四面楚歌121007,哪里来会哪里去,,,06-26
旺市如意,促进消费等于砸盘消费板块,,,06-26
田野里守望者,食品不行啊，没有主力拉啊,,,06-26
以伤换杀,弱于大盘，消费不能玩的,,,06-25
股友6563352iC6,牛来了和食品好像没有关系,,,06-25
扶摇直上de卡卡西,昨天发文件，刺激消费，今天就涨证券。,,,06-25
创世纪20160101,整天食品板块，最牛的是st加加，最近几年，从一块多涨到八块多，涨幅吊打食品板块全,,,06-25
股友6563352iC6,牛来了吗,,,06-24
丁元英01,食品熄火了？,,,06-20
严谨的南宫菡,7连跌，二代能力堪忧啊南南，一直找跌。且企业都是家族成员，谁会看好么？,,,06-21
收割机6666,今天是业绩好的红，业绩差的绿,,,06-20
daemon1229,日线周线双背离，得出来观望了,,,06-19
点石来财的珮柔,板块所有个股几乎全绿,,,06-19
旺市如意,垃圾板块连跌5天,,,06-19
股友7L826m3999,最烂的版块丶整个版块有一个牛股吗？全是跌10几年20年的股,,,06-18
旺市如意,这么垃圾，连反弹都没有，什么时候才能涨，促消费闹麻了,,,06-18
燕赵之葵,航天军工、石油探踩、大科技的走强，大消费相关概念板块必然沉寂，市场资金有限，食品,,,06-18
旺市如意,畸形板块，个股都在低位，板块却在高位，,,,06-16
记忆犹新的鱼,早就预判要大调整了，哈哈，我根本不怕主力,,,06-13
爱发飙的蜗牛,食品饮料属于避险吗？,,,06-13
燕赵之葵,食品饮料板块的人气越来越低了，意谓着散户朋友越来越少了，痛骂的越来越多了，意谓着,,,06-12
飞奔的瓜牛,这板块基本没怎么涨，跌是疯狂的跌，是搞笑板块吗,,,06-12
秀外慧中的祝莉,贝因美压的太狠了吧,,,06-04
永不追高1028,看着像变变盘，一浪比一浪高，不知道会不会补涨一下乳业,,,06-04
股市战胜,高开都低走，套利出货有，跌多涨身少，今天不好搞。,,,06-05
vvvccg,食品饮料告一段落了，这个月不想了,,,06-06
国色天香的悦儿1,明天跌多少,,,06-08
秀外慧中的祝莉,资金就不能给贝因美一点？,,,06-09
我的个神咋办2024,周一食品板块应该有机会了吧，涨二天，已经缩量调整二天了，静态结果。。。,,,06-07
大道独行_AK,原来又套人,,,06-05
积玉地段正淳,实话说，自今年以来，食品板块是真的强，随便找一个食品，都是涨！,,,06-03
小卡子,6.22加仓,,,06-05
秀外慧中的祝莉,两月流出几百亿也是牛逼,,,06-05
方向不对一切白费,贝阴美是拉几,,,06-04
忧郁的藍,缩量新高，可以撤了,,,06-04
秀外慧中的祝莉,板块涨，个股没涨，太惨了,,,06-03
MD一买就跌,板块涨，你小跌，板块跌，你大跌！真是垃圾股一只。,,,06-03
太公稳操胜券,蓝莓饮料没人喝吗？如此低估值怎么就没资金看的上呢？果汁这不比那些酒饮料好的多！,,,06-03
八方纳福的逍遥子,不拿到分红送股。机构是不会跑的。今年预案应该是10送10。,,,06-01
歩步高,#收盘点评#,,,05-30
A战必胜哥,端午节，食品饮料还不涨？真菜的一B,,,05-30
最爱周绿缩,主力真牛，机器人不拉，就拉这些烂食品,,,05-27
咎不在相,这个指数怎么不一样，而且差这么多,,,05-29
有专注力的尹奕1,珠宝首饰板块和食品饮料板块强势领涨，其实是必然的结果，特别是珠宝首饰蓄力已久，即,,,05-27
我不叫诶,食品板块，有机会，干！,,,05-27
幸福的丰川祥子,大盘跌，食品涨,,,05-27
大青山王老师,震荡向上,,,05-27
laoyu72,鸡精越抱团，越成拉级，拉级鸡精，怎么考核？个个准备倒数,,,05-27
叙旧音乐馆,春雪食品，呼叫主力操盘,,,05-27
炒股冠军军哥,周二，主力军哥买进，食品饮料股票。保龄宝，海王生物，交大昂立，凯美特气。,,,05-27
股友08579pQ679,加油啊，破新高涨涨涨,,,05-27
异动解密,短线热点转换,,,05-27
股友u88151H161,$食品饮料(BK0438)$,,,05-27
遥遥令仙,都是夕阳产业，要么价格太高，要么就是不利于身体健康添加剂太多,,,05-27
炒股冠军军哥,周二，军哥买进食品饮料夏天，饮料需求大，收入增加50%，利润增加50%。,,,05-27
风姿绰约的邱宇航,发生了什么，食品饮料都是涨停^O^国中水务,,,05-27
大胆去尝试,五日线都没碰到，向上缺口都没有补起来，看明天吗，10日线还可以,,,05-26
股友08579pQ679,冲冲冲！！！,,,05-23
孔明678,夏天来了猛干饮料,,,05-21
一飞冲天的老夫,金丹涨停了150%+,,,05-22
韭万三,代糖领涨,,,05-21
好运来吧123456,哪个基金跟踪这个板块？,,,05-21
短线擒拿6426,今天板块都不错跟都大涨，宠物经济更是概念领跑,,,05-20
股友lJZYp7,绝味食品性价比可以，可以关注,,,05-20
长虹雄鹿,27595位置最后逃命机会,,,05-07
孤岛鱼夫,新高了,,,05-20
股友3698z59Q93,就这行情还敢各种留缺口，留的越多，死的越惨,,,05-20
葛大壮,517390最后的价值硅地，冲鸭弟兄们,,,05-20
在那离别的车站,板块上天了，ETF还趴着咋这么牛逼呢,,,05-19
葛大壮,517390一行白鹭上青天,,,05-19
卡特的投机者之刃,一轮流行情,,,05-19
東方銀行强國,牛啊，食品饮料板块涨了1个多点，场内ETF食品饮料基金没一个涨的，含酒量太高了，,,,05-19
葛大壮,517390涨得飞快哟,,,05-19
每天涨一点888666,这不是消费吗？为什么不跟,,,05-16
慢就是快懂吗,牛啊，大资金一直出还能一直拉,,,05-16
皖东长红路,板块走弱了，走了走了。,,,05-16
底部见分晓,板块资金昨天最后一把拉升，资金要大规模撤出了,,,05-16
股友13W5092U78,为什么你总是跌而机构却在推荐？,,,05-15
英姿2025,食品板块就要上天了，难兄难弟们，还不赶紧增持华统股份，后面就要追高百分百,,,05-15
惬意的温琦,517390资金高低切最好的去处，冲鸭弟兄们,,,05-15
你大永远都是你大,明天大盘暴跌，食品消费类起飞,,,05-07
ljzbwf,不活跃的板，要跌！,,,05-13
GEM_鞠婧祎,板块,,,05-12
你大永远都是你大,下周加仓，别问为什么,,,05-10
ReikiVVVW,消费还能行？,,,05-09
全仓做题胆大心细,老师们，食品饮料这是有什么消息吗？,,,05-09
沉着冷静的华舒茜,天天利好，就是不涨，杀毕股，有多远跑多远,,,05-07
股友D85611m615,跌下去上不来了,,,05-06
股友785u9717N0,五一假期，消费股不行啊,,,04-28
股友D85611m615,食品暂时到头了,,,04-30
