author,comments,reply_comments,reply_authors,update
木林森初学者,大盘4000消费还在3000打转,,,11-07
股友667617Ip56,破板块，还不如个股成交量。,,,11-07
要记得空仓,呆在这个板块里过熊市,,,11-07
股友51137i196q,大盘涨，消费就砸,,,11-07
股友62837NM890,消费反弹后还是大跌！,,,11-07
打爆量化狗,板块没有带头大哥,,,11-07
莫装x易雷P,昨晚美股科技回调，今天消费老登登场表演,,,11-07
云树开清晓,年底该炒消费了。姓马的都能崛起，你消费崛起不了吗,,,11-05
股友7201L2I007,润普有人恶意做空你，你自己安排回购注销1000万股吧，必须将市值拉到八十亿去！,,,11-06
虎子又来了,100多只股的食品概念还不如一个200亿市值的成交量,,,11-05
舜水南路,食品板块小荷才露尖尖角,,,11-05
利落的爱锦鹏,#复盘记录#,,,11-05
世事难料2012,翻下记录，国庆节期间食品电影都不行，因为大家觉得行同样七八月电力不行一样,,,09-30
渭城风雨,尾盘不翘尾直接吞了昨天涨幅,,,11-04
禅门交易员,没有一个带头大哥冲看来经济差的不行了,,,11-04
股友9mfm7Y,食品饮料板块大涨1.11%，食品饮料ETF收盘0涨幅。,,,11-03
李小歪,炒完传媒和海南就轮到食品,,,11-03
笑嘻嘻的蒋凌旋1,板块轮动,,,11-03
船长趋势交易做T,底部放量，开贴跟踪,,,10-30
吾祝莊傢頭上綠,巧丽哇的！,,,10-31
中股是个老六,北证两天大涨12%，北交所食品股吃P,,,10-31
股农砖家,妙可蓝多公告，第三季度营收为13.9亿元，同比增长14.22%；净利润为4296,,,10-30
不当接盘瞎,血泪,,,10-30
谎言蔓延1980,看来下午食品饮料要绝地反击了！加油,,,10-29
欧而皇之,板块都臭了,,,10-29
九阴会,都4000点了，你还在3300晃悠呢,,,10-28
点石来财的珮柔,大盘涨他崩大盘跌他崩，无敌的板块,,,10-28
谎言蔓延1980,历史底位的食品饮料是不是能发挥一下,,,10-28
为你而喝彩,这么多是天天跌,,,10-28
可以买了,天天跌,,,10-28
谎言蔓延1980,也该食品涨了吧,,,10-28
富有积玉地李白,食品股和白酒可是要完犊子了，大盘上5000点它创新低，各位看着吧。等科技泡沫破裂,,,10-28
股友62837NM890,大级别还是震一震可能要跌的，毛汰，骗子黄，爱美彩都跌到阴沟了，第二次走了中免的道,,,10-27
努力的曹泰成,拉高就跑准没错,,,10-27
低调的老员工,全仓北交所和食品饮料,,,10-27
低调的老员工,这个板块得罪哪个机构了？,,,10-27
谎言蔓延1980,食品饮料不行就都凉快吧！！,,,10-27
股友zq0gqn,看看科技,,,10-25
叙旧音乐馆,全部退市吧，曹，HWNKAJ,,,10-26
王哥私塾,食品板块真是拉垮,,,10-24
Katch,这个板块还要存在吗？,,,10-24
谎言蔓延1980,把食品都砸了,,,10-24
楚楚的韭哥,缩到极致是利好！,,,10-24
眼光不错耐心不够,烂,,,10-24
渭城风雨,太恶心了啊,,,10-24
水上运动,这个板块是化债的，资金都是流出,,,10-24
短线累积试试,耐心等待。,,,10-23
努力的曹泰成,不会有人拉的，只会慢慢出货，板块k线这么高，跌一半又如何,,,10-23
沧海一流,密码,,,10-22
努力的曹泰成,现在居民基本不消费了，能省则省，这个板块必须等CPI好转,,,10-22
买了就涨中大牛股,这个怎么没有对应的ETF呢，一查相关的ETF都是白水占大头，明明成分股不包含白酒,,,10-21
基民63099P9U07,科技涨完，创新药涨，轮着来，永远也轮不到你,,,10-21
基民63099P9U07,还是商业百货猛啊，大家都不吃不喝吗？,,,10-21
股友631991y3E0,一个板块的交易量还不如一个热门的科技股,,,10-21
水上运动,最垃圾板块了,,,10-21
要记得空仓,给老子涨到年底,,,10-20
渭城风雨,老登,,,10-20
努力的曹泰成,这个板块基本了，拉煤炭都不拉你,,,10-20
高laoshi,太平洋证券研报分析称，牛市会抚平每一处“洼地”，“买在无人问津处，卖在人声鼎沸时,,,10-18
要记得空仓,科技要死消费当立,,,10-16
渭城风雨,老登,,,10-17
云树开清晓,半导体科技资金出来还能去哪，找低位食品啊,,,10-17
鸿运當头,食品饮料板块真的是G都不玩了。,,,10-17
水上运动,食品是真垃圾，大盘涨也跌，大盘跌也跌,,,10-17
渭城风雨,白水是老登，这个什么登,,,10-16
高laoshi,欧洲食品饮料类股上涨3%；有望创下自2月以来的最大单日涨幅。,,,10-16
雅典娜之惊叹13,明天涨点吧,,,10-16
君不陌,再也不买食品板块了，货卖不出去，全靠在这里吸血！！！,,,10-15
渭城风雨,名副其实的老登了,,,10-13
日理万机之史湘云,这板块真垮,,,10-13
眼光不错耐心不够,消费板块真是算废了,,,10-13
水上运动,拉银行也不拉消费,,,10-13
股友LXwgs5,这个板块还有救吗,,,10-09
基民55Pw899793,横盘？人才,,,10-09
股友51137i196q,没救了,,,10-09
股友0n569c0038,大盘马上要砸下来，这板块要加速向下暴跌了！,,,10-09
股友0n569c0038,这里面的票，都要去ST了，一直下跌没涨过，,,,10-09
账户已注销,光明乳业作为国企，你是不是对这一轮的改革有意见？去年924以来，大盘至少涨了50,,,09-29
飘忽dashu,这种板块把人看抑郁了,,,09-30
股动人生巅峰,绝对的老登板块,,,09-30
每天高,天天装死,,,09-30
年年多谋地容小仙,拉直线吧,,,09-30
年年多谋地容小仙,能不能红给我看看,,,09-30
一剑彪血红西蕃,这两天都起不来食品饮料这些消费就麻烦了！一旦大盘突破3900继续走牛，十一后那些,,,09-30
足智满堂的韭菜花,唉！垃圾食品,,,09-30
叙旧音乐馆,笑死了，这个板块今天缩量严重，半天不到交易50亿成交额,,,09-30
爱交易的小宝典,食品饮料是触犯了天条吗？,,,09-30
股友O3137036q0,$食品饮料(BK0438)$,,,09-30
要记得空仓,这个板块烂了,,,09-30
股友39yU2Y,明天大涨领涨,,,09-29
雷马军云,这板块是不是废了,,,09-29
小烦恼在努力,这么好的盘面，我的票票今天整体只涨了0.2，你说气人不？,,,09-29
股友8903m3T192,现在的软件不可靠，食品饮料板块在国信金太阳软件中显的是上涨了1.17。而东方财富,,,09-29
股友39yU2Y,看走势，预制菜的反弹行情来临，珍惜手中筹码……,,,09-29
股友I6L0scgU,这是犯了什么天条了,,,09-29
股友8903m3T192,1一8月食品饮料消费同比增长百分之十几,,,09-29
雅典娜之惊叹13,M头跌幅满足已经到了，还不反弹？,,,09-29
股友39yU2Y,食品饮料板块中只有靠预制菜概念板块率先反击才会激发食品板块反弹,,,09-29
叙旧音乐馆,这成交额。。不如人家一个股的成交额。僵尸板块。,,,09-29
要记得空仓,双针稳不稳,,,09-29
我和主力是老乡,这个是(o)啥？烂板块,,,09-29
刻苦耐劳的椪柑,还板块咋回事还不如白酒,,,09-29
叙旧音乐馆,太惨了，织布机板块,,,09-29
股友51137i196q,这个板块是废了啊,,,09-29
渭城风雨,拜拜了,,,09-29
股友62837NM890,这个go血板块何时止跌呢，节日来打麻木不反应的脸了，,,,09-29
YNY123789,咋消费还不起来了，一年都接近尾声了,,,09-27
股友O7v9732720,老登板块，一个月涨幅不如科技一天,,,09-26
毅力意山行,有利好没有，现在的我全靠利好活着,,,09-26
道义有道顺应天道,食品饮料这个板块调整的差不多了！民以食为天,,,09-23
AAAAA冷血股王,还没跌到底！资金不会接盘，而且这个东西没技术，没垄断力！,,,09-26
股友O7v9732720,消费行业也成老登了,,,09-26
股友8903m3T192,好奇怪，两节来临，食品饮料板块都没有上涨，都说炒预期吗？,,,09-26
股友8903m3T192,双节来临都没有行情。政策不是支持消费、拉动内需？,,,09-25
趋势为王19,食品饮料又犯天条了，没人要的拉几玩意,,,09-25
我要回本回本啊,今年没行情了,,,09-25
家乡的小树林,无人问津，根本没人理睬的板块，几年内不会有行情的,,,09-25
芝蒙等待,被抛弃了,,,09-25
股友u998698P20,这个位置到十一后绝对是赚的，俺就不跑,,,09-24
悟道中2025,这板块了,,,09-25
拉面青年,天天流出。。。。。完全被做空，怪自己瞎了眼买食品,,,09-25
渭城风雨,养元独自扛大旗吗？,,,09-25
股友39yU2Y,食品饮料行业今天雄起,,,09-25
渭城风雨,板块没救了,,,09-24
股友8903m3T192,既然还有涨停板了,,,09-24
洒脱的魏,散户抄底上车了没，系好安全带开始给我砸,,,09-24
莫装x易雷P,触犯了天条，呜呜呜呜,,,09-24
悟道_认知,台风来了，不囤一些食品？,,,09-23
gxkyxkxktxi,主力在问，消费的散户什么时候来科技接盘,,,09-23
九阴会,板块都a杀了，拉机板块，板块资金都偷偷跑去科技了,,,09-23
股动人生巅峰,今年还有比这几只票更垃圾的？,,,09-23
招财发财得白沉香,继续下跌,,,09-23
追跌杀涨方为上策,该食品饮料防守了,,,09-23
静心收益,可怜的食品板块,,,09-23
拉面青年,天天流出接近10个亿。。。。。。掏空股民，也别买吃的喝的了,,,09-23
股友MMKouF,9月食品就没涨，这回调可次次带着它，不愧是民生行业，往死搞也在所不惜。,,,09-23
渭城风雨,神憎鬼厌,,,09-23
痛苦的韭菜盒子,买个休闲食品，补仓补的现在吧收益亏没了不说，还倒贴真搞笑,,,09-22
十一手,板块不行，先到2780再看吧，缺口不补，不要买,,,09-23
坐等庄起身回生,高位科技往死里涨，酒水饮料等往死里打压！真是个好市场！,,,09-22
要记得空仓,这个板块是不是看着茅台的？？,,,09-22
一剑彪血红西蕃,科技无限幻想可以不停的讲故事！听说以后研制一颗胶囊一百年不用吃喝…利空大消费食品,,,09-22
叙旧音乐馆,机构，主力，不管不顾这个板块。死都不去接盘科技。求求你砸狠一点吧，,,,09-22
重头再来挑战万亿,本周消费该起了，国庆黄金周都忘记了吗？,,,09-22
九阴会,科技涨你跌我无话可说，科技跌你大跌，润你蚂蚁的板块资金,,,09-22
gxkyxkxktxi,必须把消费里面的散户赶到科技去接盘。科技太高主力没办法大量出货。,,,09-22
爱交易的小宝典,板块是啥意思，个股稀里哗啦的，要哭了。,,,09-22
大a梭哈哥,板块是惹天怒了吗,,,09-22
斗牛Mer,破位,,,09-22
创新的冯伟涛1,买白酒都比买这个板块强。,,,09-22
漠上游牧人,以后都往硅基生命发展了，不用吃喝的,,,09-22
东方财圣,这周末食品饮料纺织服装终于来政策利好了,,,09-21
gxkyxkxktxi,食品饮料板块勇于奉献，直接代替科技回调。消费不入地狱，谁入地狱三驾马车直奔地狱。,,,09-22
坐等庄起身回生,食品饮料是被雷打了，大盘涨也跌，跌更跌！怎么说也是大消费，都不吃饭喝酒喝饮料了？,,,09-22
拉面青年,比房地产还惨,,,09-22
待割的韭菜123,垃圾板块,,,09-22
明天不是绿就是红,打不过就加入，不和趋势做对，转换到科技板块去了。,,,09-19
如皋阿汤哥,这板块没有涨过，为啥砸？,,,09-18
KeynesF,趁着人家小棒子火鸡面卖火，就想抄袭沾点儿光的一群。这个板块最大的利好就是14,,,09-22
双刀流传人,旅游先异动了！,,,09-19
股友39yU2Y,昨天今天有异动，不排出下午率先反弹，因为节前反应，关注,,,09-19
黑色凝结,老登资产,,,09-19
黑色凝结,走势越来越像最近银行了，,,,09-19
股友55M292I750,板块排名92,,,09-19
無所吊谓,板块都跌破位了真牛逼,,,09-19
基民7912,这跌了一个星期了,,,09-19
股友9992l8121r,市场确实是非理性的，这样估值的食品饮料还要砸,,,09-19
一剑彪血红西蕃,预期都一致马上节日要到来啦！没几个月也要过年了食品肯定有行情外加科技涨太多了，到,,,09-18
er少,食品饮料可以有的个股七连跌了哈哈哈哈哈、,,,09-18
鸿运當头,食品饮料板块连GOU都不玩了,,,09-18
被主力盯上的账号,每天都10亿以上的往外流出，主力这是多么不看好食品饮料。,,,09-18
基民f6Y3360982,$食品饮料(BK0438)$,,,09-18
海潮淡淡,这个板块犯天条了,,,09-18
股价草上飞,整个板块119个股票，它倒数第一,,,09-18
如皋阿汤哥,最垃圾的板块没有之一！,,,09-18
o人生如棋o,垃圾板块,,,09-18
B352066289,@妙想红棉股份马上举办的全运会国家队篮球运动员杰最近曝光率非常高！徐杰代言亚洲沙,,,09-17
B352066289,感谢东方财富！@妙想,,,09-17
只爱女大s,消费全部退市吧,,,09-17
牛转乾坤V,中国机器人芯片算力ai电池...全球以后可以换进口食品，本地倒闭了也没事,,,09-17
九阴会,拉机板块，都没有资金玩，天天高开低走，资金都流出去科技了，解散吧,,,09-17
痛苦的韭菜盒子,为什么天天阴跌,,,09-17
雷马军云,@好想你你这公司注定倒闭。阴跌半年。大盘暴涨，你还停留在3200点,,,09-17
股友135RP18161,这板块已经彻底被放弃了,,,09-17
股友QPHG9g,这板块估计散户太多了主力不会过来的快成边角料了,,,09-17
HB阿权,桶了马蜂窝吗。跌成这样,,,09-17
谦让的雷神,大盘4000点，牛市来了，大家都在股市吃肉了，如果现在如果还预判不了过年零食饮料,,,09-11
静心收益,天天垫底,,,09-16
奋斗不息地室女座,走了4个多太阳,,,09-15
和气纳福地苏星河,板块长一个点，你爹一个点只能约你祖中,,,09-15
股命先生,今天买这个板块的都是高手,,,09-15
喜羊羊发大财,西贝神助攻,,,09-15
巴飞菲特,下周惨了,,,09-13
温情的兰仪嫦,本来国庆中秋前夕这个板块肯定会大幅上涨的，但是因为西贝预制菜那个事情，现在资金肯,,,09-13
股友QPHG9g,这种老消费板块都是边缘化了资金都在新消费板块这种板块注定要成为股市边角料,,,09-12
我不会买啊,谁买谁倒霉啊？,,,09-12
蚂蚁的寂寞生活,大盘新高，食品继续新低。一年了，牛市都不涨,,,09-12
专业炒股8888,垃圾食品废了,,,09-12
蚂蚁的寂寞生活,大家一起科技吧，都别吃别喝,,,09-12
笑眯眯de贾元春,以后不需要消费了，有科技就行,,,09-12
宏电子的智子,血包板块,,,09-12
日理万机之史湘云,这板是废了,,,09-12
美食家弟子,现在都没什么防御性版块一说了，只有典型的，用钱消费在消费股里,,,09-12
村北三号地,这个板块今年没少涨，注意回撤风险。,,,09-12
半目胜,大盘大涨，明天食品要补一个点指数笑死，很多大跌了的股今天尾盘都收回开盘价，汪汪队,,,09-11
体验炒股的趣乐,食品饮料废了,,,09-12
股友n02P181919,看看科技看看大盘张成啥样了,,,09-11
白酒有毒,消费不振，只能大力宣传科技，CPO，祖国人民繁荣昌盛,,,09-11
苏PXT242,食品板块严重低估，滞后大盘太多了,,,09-11
CSZY,科技股短期已经明显承压，几乎所有的科技股人工智能都在高位徘徊，上不去，不愿下来，,,,09-10
毛茸茸的石竹,$食品饮料(BK0438)$,,,09-10
真理至上0855,$食品饮料(BK0438)$,,,09-10
鸿运當头,没有资金要做食品饮料板块，哪怕科技的资金流出。这帮人不吃不喝吗？,,,09-10
股友8166T278n3,就没有个行业龙头老大带一带这个食品消费,,,09-10
真理至上0855,零售业大涨了,,,09-10
真理至上0855,大盘不好，先来吃喝,,,09-10
千禧天龙,这几天会爆拉信不信,,,09-10
拐点出击,$食品饮料(BK0438)$,,,09-09
A票贩子,这板块还没烂完，可以试试,,,09-09
九上悠雅,双节将近，时候大哥站出来稳定军心了！,,,09-04
基民55Pw899793,拉几玩意板块,,,09-09
苗莹煜,这报道的太好了，看看明天的食品饮料大消费应该有所表现了。,,,09-09
七彩祥耘,消费这是一日游,,,09-05
一剑彪血红西蕃,食品饮料今年天天一日游唉当当都一样唉…,,,09-05
苗莹煜,9月4日，法国表示，欧26国，支持乌，向乌派兵，下午，食品饮料必起飞。,,,09-05
苗莹煜,$食品饮料(BK0438)$,,,09-05
苏PXT242,这个板块太了,,,09-05
li788892547,下半年是食品饮料消费的主场！,,,09-04
股友n693Z53070,板块一日游今天换其他,,,09-05
B352066289,食品饮料板块确实低估。,,,09-04
时空顺序,还需要医药拉升，喝酒吃药共同进步,,,09-04
股友7zu5917306,现在看食品全是底,,,09-04
价值投资知易行难,食品饮料基金下跌,,,09-04
小女子在此,这看来食品饮料今年没有行情啊！消费起不来啊！幸好没买,,,09-03
股友zq0gqn,这种板块涨都没涨，跌起来比科技还厉害,,,09-03
白酒有毒,大消费就是个圈套，钱流动不了，财富集中炒科技，还来钱快,,,09-03
和气纳福地苏星河,大盘涨板块长你大跌。还天天跌约你。祖中,,,09-01
非常低调的散户5288,食品饮料板块尸骨累累啊,,,08-29
蓝色的烟火,国联水产，底部强势反弹突破,,,08-29
退市因美,看大盘指数就知道了，今天多空博弈激烈，分歧特别大，前两天回流的消费基金今天又抽出,,,08-28
田野里守望者,就跟大盘走势一样,,,08-28
坐等庄起身回生,食品消费是被雷噼了！！！！！,,,08-28
韭万三,被大A遗忘的角落,,,08-25
股友8166T278n3,食品消费恶心死了,,,08-13
田野里守望者,发利好就是砸盘,,,08-13
空仓也不买银行,消费政策利好啥都不会解读，谁会贷款去买吃的呢？这个贷款的政策是给汽车，手机，家电,,,08-13
生财又聚财,不买单,,,08-13
牧神秘录,指数涨上天，个股跌成狗,,,08-13
坐等庄起身回生,资金都被寒武大帝这种吸走了，消费只有等他们都爽完了再说。惨惨惨！其实那些股大部分,,,08-27
股友8166T278n3,食品消费这个板块太让人恶心了,,,08-27
半路追不抄底,涨的最高的是2亏损股这是什么市场,,,08-27
B352066289,食品饮料板块确实不错。,,,08-26
栗子熟了,这个板块里都是老炮。。新股民看不上这个。,,,08-26
飞机哥ge,生万物杨幂概念股欢乐家,,,08-25
股友667617Ip56,板块新高，股票在谷底。是怎么做到的,,,08-25
你不退市我吃肉A,这板块是中毒了吗？,,,08-25
操作自随心aka,绝味食品，主力在操盘你！绝对的龙头！,,,08-23
股友97D3W92277,牛市大家不吃零食吗,,,08-22
静静的看庄表演吧,龙头，三只松鼠！！！！！！,,,08-22
静静的看庄表演吧,三只松鼠是时候挺身而出了。游资来拉板,,,08-22
野路子天花板,看了一下，还没有涨的板块不再换股了，就等着,,,08-19
股友6563352iC6,食品股很拉升的都是高价股，一旦冲进去那就任人宰割。因为这个制度在这买进去不能马上,,,08-21
基民25o88P0873,这里面的大哥有哪几位呀？,,,08-20
积善行德知行合一,去食品饮料！！,,,08-20
基民55Pw899793,白酒都起飞了。看来还是护指数食品饮料消费压根不跟,,,08-20
股友62837NM890,本指数加速大涨，个股继续震荡下行,,,08-19
基民55Pw899793,白酒起飞了。可以冲了,,,08-19
旷课来大A,消费昨天利好全部高开低走很诡异，大盘破了新高向上空间不大了，做好防御准备，重点关,,,08-13
长韭才赢,田野股份，低位放量，未来可期,,,08-14
蓝色的烟火,国联水产,,,08-14
股友WB5GyV,$食品饮料(BK0438)$,,,08-13
股友WB5GyV,$食品饮料(BK0438)$,,,08-13
股友WB5GyV,$食品饮料(BK0438)$,,,08-13
夜之宴,食品横盘半年了严重跑输指数。轮动也要轮到！年底节假日多！有戏！现在潜伏。吃肉！到,,,08-12
一剑彪血红西蕃,再震荡下杀个一个月等我军军出了就来买你们这些地沟食品要玩就玩30厘米的北证那8个,,,08-11
防火线,化学添加剂不能食用,,,08-11
做棵小韭菜拉牛市,这个板块被遗忘太久啦，指数上去啦个股还在3300,,,08-08
红黄土豆,都是处生，出利好就出货,,,07-29
hggshjs,套那么多估计明跌停,,,07-30
静心收益,食品板块缺少龙头,,,08-01
小库库小,食品板块是被诅咒了吗？,,,08-04
以伤换杀,弱于大盘太多了,,,08-05
葛大壮,趁回调低吸卧龙电驱，冲鸭弟兄,,,08-07
以伤换杀,食品，猪肉，电力，地产，教育，农业，白酒，旅游，这些消费板块不要玩,,,08-06
创世纪20160101,一百一十八个食品股，起码一百一十个被腰斩了吧。有的甚至腰斩再腰斩再腰斩的。。可食,,,08-06
高laoshi,佳隆股份眼见为实，股谚讲；macd水上金叉，三曰线上穿四曰线，快快进场做波段，佳,,,08-06
高laoshi,佳隆股份眼见为实，股谚讲；macd水上金叉，三曰线上穿四曰线，快快进场做波段，佳,,,08-06
缺米下锅等你送米,一路穿过3400.3500，3600.我却在大消费里面看着，期待着轮到大消费来一,,,08-04
股友LXwgs5,如果周一真有避险情绪，这个板块能有点行情嘛,,,08-03
庄狗作妖,8月底，3600奶粉钱将陆续发放，看好8月份食品饮料股。记得做差价,,,08-04
小库库小,食品板块不配活着吗？,,,08-02
只买集合竞价,毛衣没谈好食品饮料农林牧渔接着奏乐接着舞！,,,08-01
基你太美了,这板块现在,,,08-01
小库库小,食品板块被下蛊了吗？,,,08-01
旺市如意,消费不涨就是假牛市,,,07-29
心态要好啊,既然没想拉，那昨天拉那一下干什么为了出货？,,,07-31
旺市如意,这板块真是一坨,,,07-31
旺市如意,这板块没了,,,07-31
股友N3w1659932,消费食品救灾，要不要涨一波？,,,07-29
大头不头大,食品该涨了,,,07-29
hggshjs,这他么恶心,,,07-29
一卖就跌买就涨,婴童概念没把板块带起来反而变相带崩加速出货了，真的恶心,,,07-29
hggshjs,有点缺火了,,,07-29
股友050Xz52095,三分钟,,,07-29
小库库小,这破大消费还有机会吗，连补涨都没有？,,,07-26
小库库小,食品板块是个什么意思？别的板块上天了。,,,07-23
股友6563352iC6,食品版块，今天全靠新股支撑，不然又要下跌了,,,07-23
股友6563352iC6,食品现在还在历史高位。其他板块都在涨，就食品板块不动。,,,07-22
高laoshi,热浪高温，热浪会大幅推高食品饮枓价格，维维股份植物蛋白饮料(液态豆奶)，““维维,,,07-21
高laoshi,【商务部：1-6月在线餐饮占餐饮收入比重增长1.9个百分点】,,,07-21
高laoshi,由于维维股份公司董秘找不到踪影，请问上市公司自今年5月高温热浪以来，公司植物蛋白,,,07-18
柯梦醉,这段期间别碰食品消费，要去买科技和算力，还有创新药。,,,07-18
招财之熊,有没有杭州的股票？我要抄底,,,07-20
万豪4375,全国7省气高温35到39夜度。,,,07-19
三木成林燊,硬生生把缺口补了，这回补，这强洗盘，牛逼！下周开始，起飞了！,,,07-18
万豪4375,饮料销售比空调卖的好几倍,,,07-18
万豪4375,高温天气连续不断，饮料销售几何式爆发！市区、景区七八倍增加销量,,,07-18
旺市如意,不涨消费那就全部存银行,,,07-18
高laoshi,热浪高温，热浪会大幅推高食品饮枓价格，维维股份植物蛋白饮料(液态豆奶)，““维维,,,07-18
高laoshi,热浪会大幅推高食品饮枓价格，拧爆汽水，vc软包饮料，汽非凡，等夏季饮品销量暴增，,,,07-17
快走别回头,物价一直涨，股价不涨，是何道理，夏季了，食品饮料消费量倍增，不像电力，用电高峰就,,,07-17
万豪4375,高温期间饮料销量暴增2到三倍。,,,07-17
股友sI2j0l,@益客食品有点邋遢,,,07-17
求求了别跌了,……,,,07-17
小库库小,板块被资金抛弃了,,,07-17
葛大壮,生意宝牛气冲天，冲鸭弟兄,,,07-17
高laoshi,【气候变化加剧极端高温多国生产生活受影响】今年北半球入夏以来，多国遭遇极端高温侵,,,07-16
积玉地段正淳,天天消费，钱都没有,,,07-17
糖火烧,国内食用油价格上涨，其中玉米油价格上涨50%，棕榈油价格上涨37%。,,,07-16
高laoshi,【建仓加仓新老基金多维度布局】在震荡的市场行情中，基金经理的建仓节奏悄然提速。一,,,07-16
牛市来了我买房,涨三周，一天就跌回去了，这市场小散们能挣钱？？？？,,,07-15
小库库小,食品饮料横盘半个月了。,,,07-14
小库库小,横盘一个月了，赶紧涨吧。,,,07-13
小库库小,食品狗了好久了，什么时候拉中阳。,,,07-12
股友6563352iC6,现在现在所有指数都是建立在银行之上。所有个股都没怎么涨。银行股一直往上拉。就是等,,,07-11
股命先生,什么玩意啊你,,,07-10
中股是个老六,北交所食品股没落了，5.6月都没怎么涨，这个七月有拉胯的不行,,,07-10
股友hjtZmn,$食品饮料(BK0438)$,,,07-09
股命先生,这版块一群,,,07-09
高laoshi,【美政府再借口“国家安全”，将推动各州禁止中国买家购买农地】美国农业部长罗林斯当,,,07-09
小库库小,明天食品饮料板块应该要爆发了。,,,07-04
灵性翻倍,要点燃板块，最好选择煌上煌,,,07-04
旺市如意,听说消费板块都是搞供应链金融的，如果暴雷的话就完了,,,07-04
进制元8126,除了消费，啥都在涨,,,07-02
有风度的龙猫,这指数一直在涨，是假的吧？小盘股里，就算涨一半跌一半，就会扯平了。大盘股除了东鹏,,,07-02
高laoshi,【下半年还会发餐饮消费券吗？上海市商务委正在研究可行方案】记者从上海市商务委获悉,,,07-01
中股是个老六,这轮大盘大涨，食品板块严重落后了。,,,06-27
