author,comments,update,sentiment_score,analysis_think
乐观的幻天飞,这和好像。。汽车零部件板块发了太多新股，没啥预期，哎,10-31,2,评论中表达对汽车零部件板块新股的失望
未来中药茅台以岭,$汽车整车(BI1029)$$房地产(IS931775)$$中药(BI1040),10-30,3,评论信息不足，无法判断情感倾向
回本难呀,五粮液都造车了,10-30,3,五粮液跨界造车可能引发市场关注，但缺乏具体信息判断情感倾向。
梦境的游人,汽车股废了，太烂了现在的,10-29,1,评论使用强烈负面词汇表达极度悲观
被按着摩擦的韭菜,整车板块被资本抛弃了吗？？？废到现在还没起色。,10-29,2,评论使用强烈负面词汇，表达对整车板块的失望
基民SmxdZv,这板块真是拉几,10-27,5,评论中'拉几'可能指板块上涨，整体为积极情绪
基民SmxdZv,半死不活的拉几板块,10-27,1,评论用'半死不活'形容市场状况，明显表达极度悲观情绪
陌生人丫,这个板块废了,10-27,1,评论使用'废了'表达极端负面情绪
股友56U682Q916,$汽车零部件(BK0481)$,10-26,3,评论中未体现明显情绪词汇，无负面或正面信息
股友56U682Q916,$汽车零部件(BK0481)$,10-26,3,评论中未体现明显情绪，无负面或正面词汇
股友75610F312h,把众泰的车都发出来，打打气,10-24,4,评论中包含鼓励性语言，但涉及负面事件背景，整体情感倾向中性偏乐观。
股友Z0v2561152,r里m垃圾退市,10-23,1,评论中使用'垃圾'形容退市，明显负面情绪
一定是趋势为王,大盘都红了,10-23,5,股市上涨表明市场情绪积极，符合极度乐观的判断
一定是趋势为王,直接拉红,10-23,4,股价迅速上涨，市场情绪积极，属于乐观情绪
小目标500万万,贵航股份主力做个人吧,10-22,2,主力资金撤离通常被视为负面信号，暗示股价可能下跌
有条理的严晟,整车板块都不咋样，但阿泰今天是真给力啊,10-22,3,整体负面，但个人亮点
普智,$汽车整车(BK1029)$,10-21,3,评论内容缺失，无法判断情感倾向
青峰剑剑剑锋青,汽车板块走的是芯片的老路，亏损涨，优质稳，长久不了,10-21,1,评论指出汽车板块重复芯片失败模式，暗示长期无法持续，属于极度悲观
股友3781E3m235,垃圾重汽带崩了板块,10-20,1,评论中使用'垃圾'和'带崩'等强烈负面词汇，表明极度悲观情绪
梦境的游人,破整车,10-20,3,评论包含负面词汇，暗示行业前景恶化，属于悲观情绪
梦境的游人,汽车整车有毛病，大盘砸他也往下砸，今天往上涨，他还往下砸,10-20,1,评论指出汽车整车问题导致大盘下跌，尽管有短期上涨，但整体情绪仍偏向悲观。
车门巴菲特,#股市怎么看#,10-19,3,评论内容过于简短，无法判断情感倾向
生财有道的伟喵喵,利空江淮货车！,10-18,4,评论中明确提到'利空'，属于负面情绪，但未提供具体原因，需根据现有信息判断。
慢牛多调整,$汽车整车(BI1029)$,10-17,3,评论中未提供具体评价或市场反应信息
美女的不是,新能源汽车补贴没有了，板块只能了,10-17,2,补贴取消导致板块前景不明，情绪偏向悲观
利興达,整个板块跌沟里,10-17,2,评论描述某个板块持续下跌，暗示负面情绪
回本难呀,放量上涨还要涨,10-16,5,放量上涨表明市场情绪积极，'还要涨'暗示未来仍有上涨空间，整体属于乐观预期。
慢牛多调整,也该轮到汽车板块了，世界智能网联汽车大会今天在北京开幕！,10-16,4,评论提及汽车板块和行业会议，暗示积极预期
麻豆G,$汽车整车(BK1029)$,10-15,3,评论内容缺失，无法判断情感倾向
钱先生a,时间窗口，本周五！,10-15,3,评论中包含时间窗口和本周五的提示，但缺乏明确的市场信息或情绪判断
麻豆G,$汽车整车(BK1029)$,10-15,3,评论内容缺失，无法判断情感倾向
空头小嘿嘿,板块废了,10-14,1,评论使用'废了'表达极度负面情绪
甘佑嘉措,汽车板块的楼梯图最标准啊～～～,10-14,4,评论中使用积极词汇，但未明确表达对汽车板块的预期，需结合上下文判断。
回本难呀,这是什么鸟板块，无耻之徒,10-14,1,评论使用'无耻之徒'表达强烈负面情绪，属于极度悲观
股友QhPUOl,这个板块感觉完了，基本全部是跳空低开的，资金都怕是走完了，现在就最后一些货了，都,10-13,4,评论表达对板块的悲观预期，但仍有部分乐观暗示
星星之火018,敢不敢飘红,10-13,3,评论含犹豫语气，'敢不敢'暗示不确定，'飘红'为积极信号，整体情绪中性
假药无底洞,今年汽车板块就是垃圾板块，超市零售百货板块都比你强……,10-13,1,评论强烈批评汽车板块，认为其表现差，其他板块更优，属于极度悲观情绪。
星星之火018,冲高回落，真有你的,10-10,3,评论表达对股价波动的不满，但未明确指向具体原因，情感倾向为悲观
林703,人形机器人这风已经越来越弱了，掀不起浪花了,10-09,2,评论指出趋势减弱，表达失望
梦境的游人,整车你不给力呀,10-09,1,评论中明确表达不满，属于极度悲观
梦幻卡卡团队,汽车零部件没几个涨的。他还算坚挺！,10-09,3,评论指出汽车零部件表现一般但依然坚挺，情感中性。
陌生人丫,现在汽车股是废了！,09-30,1,评论使用'废了'表达极度负面情绪
股友zq0gqn,这板块全是赛力斯带起来的,09-30,3,评论未明确表达褒贬，但提及赛力斯主导板块，可能偏向中性或乐观
江湖股者,一个板块居然靠众泰和海马,09-30,3,评论提及众泰和海马等汽车品牌，可能反映对相关板块的担忧
股友09888X19p7,捷佳伟创一季度业绩表现强劲，营业总收入同比增长58.95%，净利润增长22.15,09-29,5,评论中提到业绩强劲、收入和净利润同比增长，均为积极数据，体现乐观情绪
基民SmxdZv,这个板块真是恶心，半死不活的,09-29,1,评论使用强烈负面词汇表达极度悲观
骑着树刚打林平,没补贴咯,09-28,2,评论中提到'没补贴'，暗示缺乏支持，可能带有负面情绪，但未明确后果，需判断程度。
迈克尔蔡健,节前节后都是汽车零部件的天下！,09-28,4,评论强调节假日期间汽车零部件需求旺盛，体现市场预期积极
骑着树刚打林平,要噶了,09-28,1,评论中的'要噶了'表达极度悲观的情绪
基民SmxdZv,爆拉起来吧！,09-26,4,评论中'爆拉'表示股价大幅上涨，带有积极情绪，但'起来吧'可能暗示市场预期，整体偏向乐观。
基民SmxdZv,这个板块垃圾股太多了,09-26,1,评论明确批评板块中存在大量垃圾股，属于极度悲观
花开积玉地陆小凤,垃圾板块果然就是垃圾板块，永远站不上台面。,09-26,1,评论明确使用贬义词表达对垃圾板块的极度失望
忘掉过去重新开始,没想到先杀的汽车零部件,09-25,2,评论表达对市场突然抛售汽车零部件的意外，暗示负面情绪
忘掉过去重新开始,创业板早该下来了，但是没想到西安杀汽车零部件,09-25,4,评论表达对创业板的悲观预期，但具体原因不明
忘掉过去重新开始,今天杀汽车，因为欧盟税降了？,09-25,1,评论中使用'杀'字暗示股价下跌，结合欧盟税降的负面因素，属于极度悲观情绪。
花开积玉地陆小凤,这板块是真fw,09-24,2,评论中'真fw'暗示市场异常剧烈，带有负面情绪
股友ufMA3R,没人玩了，只剩主力量化表演！,09-24,2,评论中包含负面情绪，但仍有部分积极元素
账户已注销,非奸即盗概念,09-24,2,评论包含负面评价，暗示人品问题，属于悲观情绪
湖北宋宇飞,444,09-23,3,评论中无明确情感词汇，仅含数字，无法判断具体情绪
追涨的小牛,板块全烂咋搞嘛,09-23,1,评论使用'全烂'表达极度负面情绪，符合1分标准
股友n8MmOK,峰璟股份一堆资产若能盘活翻几倍不是梦！,09-22,4,评论中表达对资产盘活的积极预期，属于乐观情绪
青云子子,新进的散户，在板块挑股的时候，把广汽忽略掉，这个公司靠散户续命,09-22,3,评论指出散户忽略优质股，暗示其持续性不足，情绪偏向负面但未完全绝望。
湖北宋宇飞,444,09-22,3,评论中'444'缺乏明确情感信息，无法判断具体含义
细致的白心宇,名至实归,09-21,4,评论表达对某事物的正面评价，符合乐观情感
广土庄956,必须旭升集团。,09-20,4,评论中包含'必须'，暗示强烈推荐，但未明确情感倾向
湖北宋宇飞,444,09-19,3,评论内容为'444'，无明确情感词汇，需判断中性
股友uPjpiz,汽车股太惨了,09-19,1,评论使用'太惨了'表达强烈负面情绪
朝明夕落,$汽车零部件(BK0481)$,09-19,3,评论中未体现明显情绪，无负面或正面词汇
股友8e5785U368,又是倒数第一,09-18,2,评论指出排名靠后，暗示负面结果，属于悲观情绪
才望兴隆de令狐冲,无耻至极,09-18,1,评论表达极度负面情绪，对应1分
股友8016R1p665,为何正强就没发力,09-18,3,评论中带有疑问语气，暗示市场或该股票表现不佳，但未明确否定，可能属于中性但带有负面情绪。
纵横股海财运亨通,02434万里扬汽车零部件储能汽车芯片业绩大增！价值严重低估,09-17,5,评论提到业绩大增和价值低估，体现积极预期
坐稳扶好把牛骑,松芝股份怂庄不拉,09-17,2,评论指出庄家不积极，反映市场悲观情绪
股友000A1M6065,汽车都降价，汽车零部件还涨的这么强？？？？？？？,09-17,3,评论中存在矛盾现象，但未明确表达强烈情绪，属于中性
账户已注销,刚入市的人常因见别人赚钱而盲目跟风，却忽略高风险往往伴随高收益。缺乏认知，迟早吃,09-16,2,评论批评盲目跟风和缺乏认知，语气严厉，属于悲观情绪。
招财来财的白沉香,万里扬,09-16,3,评论仅包含公司名称，无明确情感倾向
A股A哥,没发生什么，就是要快哥使劲儿割,09-16,2,评论表达对市场无变化的失望，带有负面情绪
惬意的温琦,159806是绝世好基，冲鸭弟兄,09-15,5,评论中明确表达积极情绪，鼓励买入，属于极度乐观
华南宝安大道,赛力斯的爸爸叫江淮,09-15,2,评论涉及公司关联关系，可能隐含负面暗示
惬意的温琦,159806是绝世好基，冲鸭弟兄,09-15,5,评论使用积极词汇并鼓励买入，明显乐观
糕手中的糕手,先迈吧，桃住再研究总想靠谷市“一夜保负”，频繁追热点、换概念。赚了就盲目自信，亏,09-14,4,评论批评市场策略，但未完全否定市场，偏向中性
麻木的散户Jack,没有众泰，这个板块指数要跌成狗。一个汽车板块指数，居然靠一个今年只卖了14辆车的,09-14,1,评论强烈批评众泰对板块的影响，认为其缺席会导致暴跌，属于极度悲观
花开积玉地陆小凤,当人家都傻沙子骗炮骗了一波又一波砸下去，撬一点点继续砸往深砸，真以为人家不要命要,09-12,1,评论中使用了强烈负面词汇，表达极度悲观情绪
股友uPjpiz,怎么今天指数还涨了？,09-12,4,用户对指数上涨感到惊讶，但整体态度中性
急什么慢慢来,为什么这个板块一上去就被打下来，上面有水泥墙？,09-12,3,评论表达对板块下跌的不满，但用'水泥墙'比喻阻力，情感倾向中性偏悲观
股友09888X19p7,金杯电工2025Q1净利润持平，非经常性收益对冲了信用减值损失的影响。其他收益与,09-11,3,净利润持平，非经常性收益抵消信用减值损失，整体无明显情绪倾向
基民SmxdZv,这个板块阴跌不止，恶心,09-11,1,评论中使用'阴跌'和'恶心'表达强烈负面情绪
招财如意地波风,$汽车零部件(BK0481)$,09-11,3,评论内容为空，无法判断情感
花开积玉地陆小凤,B这种板块，唉，涨的都是一堆股好股都不涨。,09-10,3,评论中带有失望情绪，但未明确极端悲观
葛大壮,159667绝世好基，冲鸭弟兄,09-09,5,评论中使用积极词汇并鼓励跟风买入，体现极度乐观
好奇的文昭1,垃圾板块，都不如房地产,09-09,1,评论明确批评垃圾板块，认为其不如房地产，属于极度悲观
万金来c,汽车股的龙头居然是众泰,09-09,3,评论指出众泰作为汽车龙头，可能隐含对其现状的批评
自信且坚韧001,有趣这板块，只有没车的泰哥才是核心，超预期吗,09-08,3,评论中带有调侃语气，未明确表达负面情绪，判断为中性。
淋雨的燐,今天整个板块成交256亿byd59亿赛力斯63这俩成交就占一半了,09-08,4,成交量占比高暗示板块整体表现良好，可能偏乐观
猎庄擒龙777,央视唯一现场采访的企业，硬实力摆在这，宁波华翔最有希望成为未来机器人领域的最强王,09-07,5,权威认可+实力突出，积极预期
n542613572056874,比亚迪完胜,09-06,5,评论使用'完胜'表达积极评价，属于极度乐观
永远之林,汽车应该安全为第一位，再好看的车，也只是个油漆马桶，珍爱生命，不当小白鼠。国产车,09-06,3,评论批评国产车安全问题，强调安全优先，语气偏负面但不完全否定汽车价值。
股友7i01839Z38,新能源电池太阳能大部分板块都三四个点了汽车板块今天会两个点多吧,09-05,3,评论中提及板块下跌和上涨，整体情绪中性
林703,张婷没有十个就没情绪,09-05,3,评论表达模糊，可能中性或轻微负面
股友7i01839Z38,收盘板块3个点,09-05,3,评论未明确说明涨跌方向，仅提及幅度，难以判断情感倾向
股友235231gQ03,日本汽车大涨,09-04,5,评论提到'大涨'，属于积极情绪，但需确认是否涉及具体股票或行业，此处仅泛指日本汽车整体上涨，属于乐观
虾滑炒蛋,byd就扶不起的阿斗,09-04,1,用'扶不起的阿斗'形容比亚迪，明显负面情绪，属于极度悲观
小悟空闪电豹,现在长安汽车均为小盘股了。不跟指数跟垃圾退市股一起涨，还涨的挺多的，零点几,09-04,3,评论指出长安汽车为小盘股，不跟主流指数涨，但涨得较多，可能带有矛盾情绪，整体偏中性。
股友089Ie08283,这波板块上涨全是军工带起来的，下跌的时候其他个股都跟跌,09-03,3,评论指出军工带动上涨，其他个股下跌，未明确表达整体情绪
梦境的游人,高开那么多就是为了套人吗？,09-03,2,评论中带有明显的负面情绪，质疑市场行为，属于悲观情绪。
股友9605MP1215,603017中衡设计：参股多家芯片独角兽、城市高质量设计总龙头+商业卫星发射场设,09-03,5,评论中包含积极词汇，如参股独角兽、总龙头，表明高度乐观
大A是世界第一,美晨科技气车零部件最低价,09-02,3,评论仅提及价格信息，未体现情绪倾向，需结合上下文判断。
坐稳扶好把牛骑,002454跌成狗,09-02,1,评论使用'跌成狗'表达极度悲观
非诚勿扰之者,$汽车零部件(BK0481)$$斯菱股份(SZ301550)$$福赛科技(SZ3,09-02,3,评论中未提供具体市场信息，无法判断情绪
短线高效,如果没猜错，谈论最多的应该是汽车出口问题。,09-01,3,评论陈述事实，无明显情绪倾向
猎庄擒龙777,远景目标看500-1000亿市值，你们不要急着反驳我，这个目标2026-2027,09-01,4,评论中提到未来市值目标，表达对公司的长期信心，整体偏积极。
怀念权证,看看我选股水平怎么样,09-01,3,评论中无明显情绪倾向，属中性表达
猎庄擒龙777,天风证券一姐孙潇雅坚决看好机器人机会...,08-29,4,分析师看好机器人领域，属于积极信号
白酒有毒,房地产融资贷款彻底转移到汽车上面来了,08-29,2,房地产融资转向汽车可能反映行业困境，但评论未明确褒贬，需结合上下文判断。
祝你好运啦,新能源看中国，中国看江淮,08-29,4,评论表达对中国的信心，暗示新能源领域前景良好
瓦蓝的蒋亚4,倒数几家都是盈利的这句话没通过？我说错了什么？,08-28,2,评论中存在逻辑矛盾，用户质疑陈述是否正确，可能带有轻微负面情绪
娴雅文静的石港,整车今年算是废了,08-28,5,评论使用'废了'表达极度负面情绪
陆肘Z,垃圾众泰涨了9个点，直接把整车带起来了，其实其他的都没涨,08-28,3,评论中带有负面词汇但提及积极效果，整体情绪偏悲观
欢快的魏夏圆,$汽车整车(BK1029)$,08-27,3,评论内容缺失，无法判断情感倾向
江湖股者,汽车板块没涨不说今天流出43亿，排名前列！,08-27,2,评论指出汽车板块未涨且流出资金，反映市场悲观情绪
股友16F511L985,查的,08-27,3,评论缺少明确情感词汇，无法判断情绪倾向
股林林萌主,汽车板块错过牛市,08-25,1,评论指出汽车板块错过牛市，表达负面情绪
兴奋地楚留香,汽车行业带动上下游产业对国家的贡献是显而易见的，结果涨得费劲,08-25,3,评论肯定行业贡献但强调上涨困难，整体偏悲观
江湖股者,全市场唯一被抛弃的板块，实在无语,08-25,5,评论明确表达对被抛弃板块的失望，属于极度悲观
陆肘Z,什么时候可以多加几只股票进来啊，少的可怜。,08-22,3,评论中表达对当前持仓数量的不满，但未明确绝望，属于中性偏悲观
股友uPjpiz,指数涨这么多，到底是哪支汽车股在涨呀？,08-22,3,评论质疑市场表现但未明确负面情绪
股友8e5785U368,你看看江淮，你到底跟谁,08-22,3,评论中带有质疑和否定语气，但未明确表达强烈负面情绪
坐稳扶好把牛骑,002454,08-21,3,评论内容缺失，无法判断情感
江湖股者,汽车板块就是仅次于房地产一样垃圾，没有一只拿得出手,08-21,1,强烈贬低汽车板块，表达极度悲观
创越的力量,这个指数根本不准。指数新高了，却没有一只个股是新高的，怎么解释？,08-21,1,评论批评市场数据不准确，表达负面情绪
常睿懂事涨,千里科技，动力新科，都涨停了，福田3年多，1089个交易日没涨停过，,08-20,3,对比近期涨停与长期不涨停，暗示福田业绩不佳，情绪偏悲观
开朗之圣手书生,$汽车整车(BK1029)$$长安汽车(SZ000625)$,08-20,3,评论中未提供具体评价内容
chengjie7288,000887龙头品种值得重点关注！！,08-19,5,评论使用积极词汇强调龙头地位，无负面信息
大青山王老师,继续涨,08-19,4,评论表达股价继续上涨的积极预期
梦境的游人,整车股创新高了，我的还没回本儿,08-18,3,用户对整车股上涨表示高兴，但强调个人投资未回本，情绪中性但带负面因素
林703,沉默中爆发，犹豫中上涨，疯狂中崩塌,08-18,4,评论包含负面情绪关键词，但存在中性转折，整体倾向悲观
目标BMW,低位股等待爆发,08-18,3,评论中包含'等待爆发'，暗示对未来的期待但未明确表达乐观或悲观
游资坨,我买了个板块第一，优秀,08-15,5,用户明确表达对板块的高评价，用'优秀'强化积极情绪
股友K29603e185,整车板块就是边角料,08-14,1,评论用'边角料'比喻整车板块，明显负面情绪
股友P5cxVf,谁能想到这个板块的龙头会是长安B,08-14,3,评论中带有意外和惊讶，但无明显情绪倾向
股友09888X19p7,捷佳伟创2025年一季度业绩表现强劲，营业总收入同比增长58.95%，净利润增长,08-14,5,评论中明确提到业绩强劲、同比增长，属于积极信号
聪明的想爱泉7,这还是人干的事情吗？你看看指数都涨到什么程度了。。。,08-13,1,评论质疑市场行为并指出指数高，可能反映对市场过度乐观的不满
江湖股者,整个市场似乎把汽车整车板块遗忘，长城那个魏孙子是罪魁祸首,08-13,1,评论强烈批评汽车整车板块被市场忽视，暗示具体公司（长城汽车）是罪魁祸首，情绪极度负面。
股友8e5785U368,又是倒数,08-12,2,评论中'又是倒数'暗示持续负面排名，可能带有悲观情绪
韭菜墩子,整个版块没有一个涨停啊,08-12,2,评论指出板块无涨停，反映市场情绪低迷
华尔街捡瓶子,正裕工业底部可以进？,08-11,4,评论暗示正裕工业底部可买入，体现乐观预期
陆肘Z,汽车零部件从最初的800涨到了4万多，汽车整车这个玩意儿怎么还在1000多，谁能,08-11,3,对比涨幅差异暗示对整车行业不满，但情绪未明确极端
股友P5cxVf,啥时候新高？？？明天吗？,08-11,4,用户询问未来股价是否会上涨，语气中性但带有期待
江湖股者,这垃圾板块，实数严重失真，板块里面除了江淮，躲过牛市,08-08,1,评论强烈批评板块表现差，情绪极度悲观
股友P5cxVf,板块不突破，任何个股的拉升都等于圈圈,08-08,1,评论指出市场整体无上涨潜力，个股无有效拉升可能，属于极度悲观
猎庄擒龙777,调整到5日线？10日线？还是20日线呢,08-08,3,询问技术分析均线策略，无明显情绪倾向
股友Po9NZD,$汽车整车(BK1029)$,08-07,3,评论中无情感词汇，仅含股票代码，无法判断情感倾向
monterhunter,这个汽车零部件板块都要上天了！！这板块走出了90度直角！！泡沫上天了,08-06,4,评论使用强烈词汇表达对板块的乐观，但最后提到泡沫，可能暗示风险，整体情绪偏积极但存在警告。
身在罗刹囯,很多次全国哪里下了大暴雨，股市就反映在汽车和汽车零部件，因为泡水车太多了,08-06,1,评论指出自然灾害导致股市下跌，表达强烈负面情绪
股市不挨刀,板块3天涨了6个点，我tm一个涨停板没吃到。,08-06,3,板块上涨但个人未获利，表达不满
享界s9厂长,倒数第一,08-05,1,评论中包含'倒数第一'，暗示负面排名，可能属于极度悲观
静安新金路,okok准备起飞吧,08-05,4,评论中包含积极词汇'起飞'，但'okok'可能为用户名，整体情绪偏乐观
玻璃吃人cap,大家快去看看金钟股份吧双W底箱体横盘两年了恶庄跟你干到底,08-05,3,评论中包含负面情绪，但整体偏中性
正义象征,烂股，连板块都涨不过，业绩再好求不顶,08-04,1,评论明确批评股票表现差，情绪极度悲观
被按着摩擦的韭菜,大资金什么时候轮动到整车？全仓在整车。,08-04,3,评论询问资金轮动时间，隐含对整车板块的关注，但未明确表达积极或消极情绪。
sucksid,小纳都跳了那么多香港也如此,08-03,3,评论描述市场波动但未明确情绪，属中性
才望兴隆de令狐冲,……,08-01,1,评论内容不完整，无法评分
编号391015,汽车基本上见顶了，历史新高了,08-01,3,评论包含'见顶'和'历史新高'，矛盾情感，需综合判断
山子高科集团,重复昨天的剧本，真是没意思。虽然我的股没有高开大涨，但是也被带崩了，最近一个月这,08-01,4,评论中表达对市场走势的失望，但未达到极度悲观
小偷摸金,这板块最菜的属于德赛西威,07-31,1,评论指出德赛西威是板块中最差的，负面情绪明显
大A是世界第一,飞流直下三千尺，空头才是王道,07-31,3,诗句比喻市场空头占优，但整体情绪中性
蕙质兰心的鲁菡荧,你这个板块涨的很多吗，跌那么狠,07-31,3,评论中包含对板块下跌的负面情绪，但未明确表达强烈悲观，可能为中性或轻微悲观。
短线实盘侠,海马股中有退市风险的ST价格都比你高许多，海南唯一有新能源资质的整车车企，自贸区,07-30,1,评论提及退市风险和高价，但未见积极因素，偏向悲观
才望兴隆de令狐冲,金龙最拉基,07-30,5,评论使用'最拉基'形容金龙，明显褒义，属于极度乐观
股友7G92x26182,新能源汽车板块近期新增投入聚焦于技术迭代与产能扩张，头部企业加速布局固态电池和8,07-30,5,评论提及技术迭代和产能扩张，暗示积极布局，整体乐观
才望兴隆de令狐冲,你这个拉基倒数第一,07-28,1,评论中明确指出'倒数第一'，带有明显贬义，属于极度悲观
葛大壮,卧龙电驱，资金疯狂抢筹，冲鸭弟兄,07-28,4,资金抢筹表明积极信号，但后半句情绪化表述
有教养的夏聪3,下周炒新能源汽车和配套产业链，中国长安集团起飞,07-26,5,评论强调新能源汽车和配套产业链的强势崛起，表达积极预期
江湖股者,这垃圾板块怎么都轮不到了呢，几个月没有一只涨幅单天上5个点的,07-23,1,评论中表达了对板块表现的极度不满
被按着摩擦的韭菜,大盘都3600了，这个拉几整车板块，一点动静都没有，拉几魏还有影响吗？？？？,07-23,2,评论指出某板块表现低迷，暗示负面情绪
被按着摩擦的韭菜,整车板块，狗都不买，很长时间没轮动到了。,07-22,1,评论指出整车板块长期无轮动，市场冷淡，属于极度悲观
股友X79k156287,新王再现！持有无虞……,07-22,5,评论使用积极词汇表达对股票的乐观预期
股友eFCgsX,买二手车,07-21,3,评论缺乏明确情绪，但涉及二手车购买可能隐含风险，倾向中性
基民l316920C10,没钱买,07-21,2,评论中明确提到'没钱买'，表明经济限制，属于负面情绪
焦急的张丹5,赛力斯最拉鸡的之一,07-21,1,评论中使用'拉鸡'表达极度负面情绪
棒棒2024,还是贵,07-18,3,评论中'贵'表达价格过高，属于负面情绪，但未达极端悲观程度
